重い家具や本棚が倒れてくるかもしれない場所、照明やガラスが割れて落ちてくる所に、自分や家族は寝ていない。,,,,,
やること,建物全体を揺らす実験動画,http://www.bosai.go.jp/hyogo/research/movie/wmv/20080124_t1.wmv,南海地震を想定した震動実験。キッチン・リビング・オフィス・寝室における危険性や耐震対策の効果を示している。,防災科学技術研究所　兵庫耐震工学研究センター,1
学び,地震犠牲者の死亡原因,https://www.do-it-yourself2014.com/app/download/13268628027/%E5%9C%B0%E9%9C%87%E3%80%81%E8%A1%A8%E7%A4%BA%E7%94%A8%E3%80%90%E6%97%A5%E6%9C%AC%E8%AA%9E%E3%80%91.png?t=1494988601,事前の地震対策の大切さを、研究論文のデータ引用で示しています。（アプリ「減災教室」ABOUTより）,一般社団法人Do It Yourself,1
やること,家庭内DIG　地震がきてもわが家で暮らす方法,http://www.pref.shizuoka.jp/bousai/chosa/documents/kateinaidig.pdf,家屋内の間取りや家具の配置を確認することで、震災時の危険を理解し、今できる対策が何かを考えることができるワークシートです。,静岡県,1
やること,地震・災害に備えて、今日からできる防災震災対策,http://yamanacy.jp/special/110401_bousai.html,自宅の点検箇所・内容や非常備蓄品など見やすく書いてあります。,山梨県webマガジン やまなしぃ,
学び,地震時の住宅家屋内における人的被害に関する検討,http://crf.flib.u-fukui.ac.jp/dspace/bitstream/10461/4785/1/yoshida.%2837%29.pdf,【論文】1993年の３つの地震を事例に、地震時の住宅家屋内での人的被害の傾向や住宅家屋の被災との関連について述べています。,福井県地域協働リポジトリ,
事例,耐震シェルター・防災ベッド,http://www.pref.shiga.lg.jp/bousai/portal/kanren/files/02syoukai.pdf,個人木造住宅への耐震シェルター等の普及事業で、具体的に紹介しています。,滋賀県,
